{
  "schemaVersion": 1,
  "generatedFrom": "independent-web-audit-2026-07-13",
  "shippingEligible": false,
  "songs": [
    {
      "id": "acdc-back-in-black",
      "artist": "AC/DC",
      "searchAliases": ["에이씨디씨"],
      "title": "Back in Black",
      "tuningId": "guitar-6-standard",
      "tuningVersion": 1,
      "capoFret": 0,
      "centsOffset": 0,
      "researchConfidence": "web_verified",
      "verificationStatus": "needs_human_review",
      "sources": [
        { "label": "Jon MacLennan lesson — E standard", "url": "https://www.jonmaclennan.com/blog/back-in-black-chords", "checkedAt": "2026-07-13", "checkedBy": "Codex source audit; human review pending" },
        { "label": "Line 6 song setup — standard tuning", "url": "https://line6.com/data/6/0a0643891075c57b6438b9832f/application/pdf", "checkedAt": "2026-07-13", "checkedBy": "Codex source audit; human review pending" }
      ],
      "notes": "Independent sources agree on E standard; no capo or recording offset asserted."
    },
    {
      "id": "acdc-highway-to-hell",
      "artist": "AC/DC",
      "searchAliases": ["에이씨디씨"],
      "title": "Highway to Hell",
      "tuningId": "guitar-6-standard",
      "tuningVersion": 1,
      "capoFret": 0,
      "centsOffset": 0,
      "researchConfidence": "web_verified",
      "verificationStatus": "needs_human_review",
      "sources": [
        { "label": "Jon MacLennan lesson — E standard", "url": "https://www.jonmaclennan.com/blog/highway-to-hell-chords", "checkedAt": "2026-07-13", "checkedBy": "Codex source audit; human review pending" },
        { "label": "CSG Academy chart — standard tuning", "url": "https://csgacademy.com/wp-content/uploads/2015/10/Highway-To-Hell.pdf", "checkedAt": "2026-07-13", "checkedBy": "Codex source audit; human review pending" }
      ],
      "notes": "Independent sources agree on E standard; no capo or recording offset asserted."
    },
    {
      "id": "metallica-enter-sandman",
      "artist": "Metallica",
      "searchAliases": ["메탈리카"],
      "title": "Enter Sandman",
      "tuningId": "guitar-6-standard",
      "tuningVersion": 1,
      "capoFret": 0,
      "centsOffset": 0,
      "researchConfidence": "web_verified",
      "verificationStatus": "needs_human_review",
      "sources": [
        { "label": "Yousician song guide — standard tuning", "url": "https://yousician.com/songs/guitar/enter-sandman/62a6f7f5249d8522467d1d28", "checkedAt": "2026-07-13", "checkedBy": "Codex source audit; human review pending" },
        { "label": "Chachi Guitar chart — standard tuning", "url": "https://chachiguitar.com/wp-content/uploads/2020/11/Enter-Sandman.pdf", "checkedAt": "2026-07-13", "checkedBy": "Codex source audit; human review pending" }
      ],
      "notes": "Independent sources agree on E standard; no capo or recording offset asserted."
    },
    {
      "id": "metallica-master-of-puppets",
      "artist": "Metallica",
      "searchAliases": ["메탈리카"],
      "title": "Master of Puppets",
      "tuningId": "guitar-6-standard",
      "tuningVersion": 1,
      "capoFret": 0,
      "centsOffset": 0,
      "researchConfidence": "web_verified",
      "verificationStatus": "needs_human_review",
      "sources": [
        { "label": "Guitar World lesson — standard tuning", "url": "https://www.guitarworld.com/lessons/how-to-play-master-of-puppets-on-guitar", "checkedAt": "2026-07-13", "checkedBy": "Codex source audit; human review pending" },
        { "label": "Riffhard tuning guide — E standard", "url": "https://www.riffhard.com/how-to-tune-your-guitar-for-master-of-puppets/", "checkedAt": "2026-07-13", "checkedBy": "Codex source audit; human review pending" }
      ],
      "notes": "Independent sources agree on E standard; no capo or recording offset asserted."
    },
    {
      "id": "nirvana-smells-like-teen-spirit",
      "artist": "Nirvana",
      "searchAliases": ["너바나"],
      "title": "Smells Like Teen Spirit",
      "tuningId": "guitar-6-standard",
      "tuningVersion": 1,
      "capoFret": 0,
      "centsOffset": 0,
      "researchConfidence": "web_verified",
      "verificationStatus": "needs_human_review",
      "sources": [
        { "label": "Mr Tabs lesson — standard tuning", "url": "https://www.mrtabs.com/guitar-tab/nirvana-smells-like-teen-spirit/", "checkedAt": "2026-07-13", "checkedBy": "Codex source audit; human review pending" },
        { "label": "CSG Academy chart — standard tuning", "url": "https://csgacademy.com/wp-content/uploads/2016/04/Smells-Like-Teen-Spirit.pdf", "checkedAt": "2026-07-13", "checkedBy": "Codex source audit; human review pending" }
      ],
      "notes": "Sources support the open-string setup; no recording-specific cents correction is asserted."
    },
    {
      "id": "guns-n-roses-sweet-child-o-mine",
      "artist": "Guns N' Roses",
      "searchAliases": ["건즈 앤 로지스", "건스 앤 로지스"],
      "title": "Sweet Child O' Mine",
      "tuningId": "guitar-6-eb-standard",
      "tuningVersion": 1,
      "capoFret": 0,
      "centsOffset": 0,
      "researchConfidence": "web_verified",
      "verificationStatus": "needs_human_review",
      "sources": [
        { "label": "JustinGuitar lesson — E-flat standard", "url": "https://www.justinguitar.com/songs/guns-n-roses-sweet-child-o-mine-intro-chords-tabs-guitar-lesson-st-376", "checkedAt": "2026-07-13", "checkedBy": "Codex source audit; human review pending" },
        { "label": "MusicRadar lesson — original in E-flat standard", "url": "https://www.musicradar.com/tuition/guitars/weekend-riff-guns-n-roses-sweet-child-o-mine-intro-riff-601537", "checkedAt": "2026-07-13", "checkedBy": "Codex source audit; human review pending" }
      ],
      "notes": "Independent sources agree on E-flat standard for the original recording."
    },
    {
      "id": "foo-fighters-everlong",
      "artist": "Foo Fighters",
      "searchAliases": ["푸 파이터스"],
      "title": "Everlong",
      "tuningId": "guitar-6-drop-d",
      "tuningVersion": 1,
      "capoFret": 0,
      "centsOffset": 0,
      "researchConfidence": "web_verified",
      "verificationStatus": "needs_human_review",
      "sources": [
        { "label": "JustinGuitar lesson — Drop D", "url": "https://www.justinguitar.com/songs/foo-fighters-everlong-chords-tabs-guitar-lesson-st-417", "checkedAt": "2026-07-13", "checkedBy": "Codex source audit; human review pending" },
        { "label": "Guitar Lessons 365 lesson — Drop D", "url": "https://guitarlessons365.com/everlong-guitar-lesson-foo-fighters/", "checkedAt": "2026-07-13", "checkedBy": "Codex source audit; human review pending" }
      ],
      "notes": "Independent sources agree on Drop D."
    },
    {
      "id": "rage-against-the-machine-killing-in-the-name",
      "artist": "Rage Against the Machine",
      "searchAliases": ["레이지 어게인스트 더 머신"],
      "title": "Killing in the Name",
      "tuningId": "guitar-6-drop-d",
      "tuningVersion": 1,
      "capoFret": 0,
      "centsOffset": 0,
      "researchConfidence": "web_verified",
      "verificationStatus": "needs_human_review",
      "sources": [
        { "label": "Tom Morello MasterClass case study — Drop D", "url": "https://www.masterclass.com/classes/tom-morello-teaches-electric-guitar/chapters/case-study-killing-in-the-name", "checkedAt": "2026-07-13", "checkedBy": "Codex source audit; human review pending" },
        { "label": "JustinGuitar lesson — Drop D", "url": "https://www.justinguitar.com/songs/rage-against-the-machine-killing-in-the-name-chords-tabs-guitar-lesson-sb-314", "checkedAt": "2026-07-13", "checkedBy": "Codex source audit; human review pending" }
      ],
      "notes": "Artist-led lesson and independent lesson agree on Drop D."
    },
    {
      "id": "foo-fighters-my-hero",
      "artist": "Foo Fighters",
      "searchAliases": ["푸 파이터스"],
      "title": "My Hero",
      "tuningId": "guitar-6-standard",
      "tuningVersion": 1,
      "capoFret": 0,
      "centsOffset": 0,
      "researchConfidence": "web_verified",
      "verificationStatus": "needs_human_review",
      "sources": [
        { "label": "Guitar Lessons 365 lesson — E standard", "url": "https://guitarlessons365.com/my-hero-guitar-lesson-foo-fighters/", "checkedAt": "2026-07-13", "checkedBy": "Codex source audit; human review pending" },
        { "label": "CSG Academy chart — standard tuning", "url": "https://csgacademy.com/wp-content/uploads/2019/05/My-Hero.pdf", "checkedAt": "2026-07-13", "checkedBy": "Codex source audit; human review pending" }
      ],
      "notes": "Song-specific sources agree on E standard; artist-level tuning summaries were rejected where they conflicted."
    },
    {
      "id": "tool-schism",
      "artist": "Tool",
      "searchAliases": ["툴"],
      "title": "Schism",
      "tuningId": "guitar-6-drop-d",
      "tuningVersion": 1,
      "capoFret": 0,
      "centsOffset": 0,
      "researchConfidence": "web_verified",
      "verificationStatus": "needs_human_review",
      "sources": [
        { "label": "Guitar Lessons 365 lesson — Drop D", "url": "https://guitarlessons365.com/schism-guitar-lesson-tool/", "checkedAt": "2026-07-13", "checkedBy": "Codex source audit; human review pending" },
        { "label": "MusicRadar Adam Jones lesson — Schism in Drop D", "url": "https://www.musicradar.com/how-to/tool-guitar-lesson-adam-jones", "checkedAt": "2026-07-13", "checkedBy": "Codex source audit; human review pending" }
      ],
      "notes": "Independent sources agree on Drop D."
    },
    {
      "id": "nirvana-come-as-you-are",
      "artist": "Nirvana",
      "searchAliases": ["너바나"],
      "title": "Come as You Are",
      "tuningId": "guitar-6-d-standard",
      "tuningVersion": 1,
      "capoFret": 0,
      "centsOffset": 0,
      "researchConfidence": "web_verified",
      "verificationStatus": "needs_human_review",
      "sources": [